<?xml version="1.0" encoding="UTF-8"?>
<actor xmlns:xsi="http://www.w3.org/2001/XMLSchema-instance" xsi:noNamespaceSchemaLocation="file:///C:/_Project/NIST/Source/github/cpsframework/test.xsd">
	<name>clock</name>
	<description>A time keeping device</description>
	<concerns>
		<timing>
			<Synchronization>
				<property>clock can receive time sync from gps system</property>
				<tracing>/a/b/c/d</tracing>
			</Synchronization>
			<IntervalAndLatencyControl>clock drifts by less than 1 second per day</IntervalAndLatencyControl>
		</timing>
	</concerns>
</actor>
